Sentence,Athletic,Intelligence,Intangibles,Maturity
"Teddy doesn't have elite arm talent to push the ball down the field consistently for 16 weeks, so you scheme verticals for him - just like Sean Payton did last year.",1,0,0,0
Payne walked over to the crowd with a message as soon as the buzzer ended.,0,0,0,0
Murray has since seemingly tipped his hand that he intends to play football - a decision that is likely to lead to a greater immediate payday.,0,0,0,0
"A fantastic leader and a guy that players really look up to,"" Payton said Saturday.",0,0,1,0
"A lot of quarterbacks have tried to knock off Sean Payton's New Orleans Saints teams over the years, but few of them have enjoyed much success or staying power.",0,0,0,0
"As a five-star talent with remarkable physical tools, he tends to rely on his natural gifts and fails to pay attention to the details when it comes to the fundamentals.",1,0,0,0
Bortles is also athletic enough to make defenses pay with his legs.,1,0,0,0
"But if the gamble pays off, and Bradford stays healthy, he will become a free agent at a time when salaries will be skyrocketing.",0,0,0,0
"But let's be honest, were you even going to pay a second thought to the Carolina Panthers with Jimmy Clausen at the helm in 2011?",0,0,0,0
"But Payton acknowledged this week that, ""I don't know that we had decided fully yet.",0,0,0,0
But that wouldn't be making a prediction or a decision above your pay grade.,0,0,0,0
"But the decision to sign Fitzpatrick to a two-year, $11 million contract is paying dividends for Rosen and the franchise.",0,0,0,0
But the early-round premium one will have to pay could prove dangerous.,0,0,0,0
"During last year's Manning Passing Academy, he spent most of his time picking Payton Manning's brain about footwork and five- and seven-step drops.",0,1,0,0
"Even Vikings quarterback Case Keenum, a less accomplished rusher than Newton, has made teams pay with his legs this season by extending plays and forcing the secondary to scramble.",1,0,0,0
"Given mental and communication miscues that have stung the D, Allen will have the same type of mandate from Payton that Ryan couldn't deliver on: Simplify the schemes.",0,1,0,0
Goff does have just enough speed to make defenders pay in the NFL.,1,0,0,0
He also understands that all parents pay local taxes that go toward the school system.,0,1,0,0
He has the kind of institutional knowledge within the division that could pay dividends in what promises to be a complicated and challenging process if and when the Giants take the field.,0,0,0,0
Herbert said his approach and leadership style is paying off.,0,0,1,0
He's acknowledged it multiple times since signing his four-year contract worth $35 million in guaranteed pay.,0,0,0,0
"However brilliant the present - however awesome Griffin's talents, however inconceivable his speed - it was merely the downpayment for a generation of greatness to come.",1,0,0,0
"If Bortles can help the Jaguars win the AFC South and continue to show he can be efficient, it could have significant financial payoff.",0,1,0,0
"In any other draft, he'd be the no-brainer number one overall pick, and someone will (and should) pay that kind of price to add him.",0,0,0,0
"In reviewing film of the Bucs, Saints coach Sean Payton has taken notice of Winston's recent run prowess and he sees a confident quarterback.",0,1,1,0
"In that case, nothing is stopping him from succeeding - and with how inconsistent Baltimore's offense has been this season, maybe a temporary change to Griffin could pay off.",0,0,0,0
"It's only natural, then, that we're going to pay a little extra attention whenever Jones matches up against one of those other first-round quarterbacks from the 2021 draft.",0,0,0,0
"Jones acknowledged the high price the Cowboys were willing to pay for Lynch, especially with the needs this team has on the defensive side of the ball, but obviously thought it was worth it.",0,0,0,0
The athletically gifted Hill was still available for his impact as a specialty weapon.,1,0,0,0
Not overpaying for Lynch was amazing dumb luck for Jones.,0,0,0,0
One of the NFL's true developmental projects is paying big-time dividends for the Texans.,0,0,0,0
"Partying his 20s away may be childish and foolish, but he'd be the one to pay for it.",0,0,0,1
Payton acknowledged this is the first time the Saints have come close to drafting a QB that high in his 12 years as Saints coach.,0,0,0,0
"Recruiters and officials at MSU alleged the pay-by-play scenario put forth by Cecil Newton, but Auburn maintained they had no knowledge or involvement (at least one part of that is right).",0,0,0,0
"Returning to his natural position in the second half, Payton threw a touchdown pass off a halfback option.",0,0,0,0
"Rodgers was clearly rusty as he seemed to rush back from his recovery to give the Packers a fighting chance to make the playoffs, but the Panthers made him pay for that decision.",0,0,0,0
"""Sean just wants to know,"" Rapoport wrote that a source with knowledge of Payton's thinking said.",0,0,0,0
So that's why Winston's decision to take a step back and learn behind two of the all-time greats in Payton and quarterback Drew Brees was met with praise.,0,0,0,1
"Stefanski understood that as Mayfield learned yet another offense and worked with a third play-caller in as many years, a conservative approach early would pay off in the long run.",0,0,0,0
"Tennessee sealed the deal on the first possession of overtime with a commanding six-play, 82-yard drive and Derrick Henry found paydirt for the walk-off victory.",0,0,0,0
"The Bucs have been able to fluster opponents with a powerful pass rush, but when QBs have found time in the pocket they've been able to make Todd Bowles' defense pay.",0,0,0,0
The knowledge could pay off for the Bengals Sunday at Baltimore.,0,0,0,0
"The next game can't come quick enough,"" coach Sean Payton said Sunday after the NFC South leaders rebounded from an ugly loss to last-place Atlanta with a 34-17 victory over the Tampa Bay Buccaneers.",0,0,0,0
"There are certain things you're going to do to be smart, relative to the division,"" Payton said.",0,1,0,0
"They don't make unforced mistakes on the field, they don't overpay at the wrong positions and they don't pass on a no-brainer like signing Newton.",0,0,0,0
Universities should be held accountable for enrolling jocks that are dumb as a wall just so they can win and make money and pay their shifty coaches.,1,1,0,0
"We work scramble drills all week, so I'm glad it's starting to pay off.",1,0,0,0
"When asked about the challenges of defending a dynamic quarterback like Murray, Payton expressed great respect for the rookie's abilities.",1,0,0,0
"While it's premature to discard Goff as an epic draft bust, it's fair to wonder when the franchise's windfall investment might start paying dividends.",0,0,0,0
"Winston looked as good as five touchdowns would indicate, too, showing complete command of the offense and frequently hitting the big-play shots Payton called for.",0,0,0,0
But any of RG3's social awkwardness - perceived or otherwise - would be easy to over look if he was playing well.,0,0,0,0
Cleveland coach Kevin Stefanski declined Friday to say what his team's plan would be for the pregame regarding any social justice message.,0,0,0,0
"During Super Bowl XLIV, Tebow appeared in two 30-second ads for the socially conservative group Focus on the Family, which spawned a horde of detractors blasting him for the group's pro-life message.",0,0,0,0
Getting a UCLA degree might enhance Rosen's chances of becoming the next Bruin whose name is synonymous with not only athletic greatness but also meaningful social change.,0,0,0,0
"In the past, social structures and leadership used to be very defined and clear-cut.",0,0,0,0
"Jefferson County school officials said the donation will ensure students have the opportunity to be their best athletically, academically, artistically and socially.",0,0,0,0
Mayfield is one of 11 players on the Browns' social justice leadership committee.,0,0,0,0
"Now using voice to help call on the NFL to combat racism within the league, Watson alongside dozen of athletes appeared in a powerful video in June to amplify the racial and social injustices.",0,0,0,0
"Supporting our three big goals, we have defined seven pillars, underpinned by targets encompassing social, environmental and economic areas.",0,0,0,0
The team launched a social justice initiative to help area residents build stronger relationships with area police among other programs.,0,0,0,0
"Winston himself hopped in a red Ferrari and took off, returning 30 minutes later to socialize a bit more.",0,0,0,1
A lot of this comes down to consistent mechanics and weight transfer as both quarterbacks were strong in the midsection and showed they could rip it.,1,0,0,0
"A productive junior entrant with excellent athleticism at 270 pounds, he is an excellent long-term prospect and a great fit for New England.",1,0,0,0
A stranger responded with a profane message about the quarterback's football ability.,0,0,0,0
"After transferring from Bowling Green, Morgan established a school record with 28 TD passes in 2018 as he flourished in a pro-style attack.",0,1,0,0
"All five of Cal's losses were to quality teams, but truly dynamic and transcendent quarterbacks find ways to beat some of the top tier teams in their way.",0,0,0,0
Allen's been so dangerous because he transformed into a surgical passer.,0,1,0,0
"Already reports are coming out of Los Angeles about Goff's easy transition learning this offense, how he's bigger and stronger and becoming more of a leader.",1,1,1,0
"Andrew was a natural, as if everything his father knew about the game had been transferred to him via genetic code.",0,1,1,0
But concerns lingered about how he would translate to a pro-style offense after playing in Red Raiders' freewheeling attack.,0,1,0,0
"But despite the departure of the superlative quarterback, Clemson has managed to survive by transforming the strength of its offense overnight.",0,0,0,0
But his most impressive play of the day was a third quarter scramble on third-and-long that is the sort of rabbit-from-hat trick executed only by the league's transformational quarterbacks.,1,0,0,0
But how would it fare with someone that can transcend past its fundamental needs?,0,0,0,0
But the key is to allow that weight transfer to occur naturally.,0,0,0,0
"But the transition from a spread offense where he ran with the ball at will, to a pro style offense where running is a last resort, won't be an easy transition.",1,1,0,0
"But Trubisky never acknowledged the transactions with a ""like"" or a comment.",0,0,0,1
"But, in between the sportball mayhem that transforms the brains of large men into mushy margaritas, there is on occasion some redemptive cultural thing worth celebrating.",0,0,0,0
Clearly has the intelligence to transition.,0,1,0,0
Denver is strangely confident that coordinator Pat Shurmur is going to be Lock's Sean McVay despite a decade-plus of mediocre results from Shurmur's passing games.,0,0,0,0
Directly after this picture I sprinted to the front entrance to see my step dad passed out!,0,0,0,0
"Dolphins management may be making a wise decision considering that the other AFC East teams are poised for more wins, but this does not translate into great productivity from Tannehill.",0,0,0,0
"Each side of this transaction made the right decision, but every deal has a winner and a loser, even if it's considered a win-win proposition at the time.",0,0,0,0
"Love's skills should translate well into a West Coast offense, especially one that will utilize a mobile passer and has a good offensive line.",1,0,0,0
"For now, the main focus from those two is learning the playbook and eventually letting that knowledge translate to the field.",0,1,0,0
"Goff's transition from Cal's Air Raid offense to the Rams' more conventional, pro-style system always was going to be a challenge.",0,1,0,0
"He put up huge numbers in college, but there are plenty of questions as to how he can translate to a pro style offense.",0,1,0,0
"He transitioned to crutches two weeks ago after roughly six weeks without any weight-bearing, and has been quite mobile ever since, including utilizing just a single crutch to get around currently.",0,0,0,0
"He's stranded in The Twilight Zone, the last quarterback on Earth, gifted with everything he's ever wanted.",0,0,0,0
His ability to pick up first downs and have a high completion percentage made him a dangerous quarterback last season even if it didn't translate into a lot of passing yards or touchdowns.,0,0,0,0
His football intelligence and character should guide him well through the transition.,0,1,1,0
"His rookie year was rough, understandable for even a third overall pick when he's transitioning from the University of Central Florida to the NFL.",0,0,0,0
"Houston's coaches deserve credit for easing Watson's NFL transition by playing to his strengths with a foundation of run-pass option (RPOs), traditional option, play-action and rolling pockets.",1,0,0,0
How would his leadership translate to an older locker room?,0,0,1,0
"I firmly believe that line of thought played a role in the decision to pick Manuel this season, but with the transition beginning so soon, my view on the matter has changed.",0,0,0,0
"If a student leaves that school's athletic programs, they would be subject to the same transfer rules that govern public school students.",0,0,0,0
"If Griffin continues to marry determination and craft with talent and pure speed, there is the possibility of a transcendently great player.",1,0,1,0
"If you rush or force the weight transfer to your front plant leg too early, it creates an all arm throw that lacks velocity and consistent accuracy.",1,0,0,0
"In a life filled with countless heady decisions, deciding to transfer was arguably the best one Tebow ever made.",0,1,0,0
"In the spirit of transparency, I'll say I was embarrassed.",0,0,0,1
"In their reactions to Luck, current and former players transition quickly from shock to understanding the physical and mental toll of grinding out a football career.",0,0,0,0
"It can't be an easy transition going from central command to the sideline, especially for an alpha male such as Wentz.",0,0,1,0
"It might not be the biggest deal for Trubisky, but it doesn't project an image of confident leadership when people have to circle back and translate your press conferences the next day.",0,0,1,0
"It's fun to see on highlights, but this is an area where Newton's elusive, open-field moves better translate to the NFL.",1,0,0,0
"It's what passes for decorum inside a merciless culture, a way of ensuring a peaceful transition of power.",0,0,0,0
"Luck struggles a bit with the slide thing but he consistently transforms the bad play into good, and he's getting better and better at it.",0,1,0,0
Mahomes likewise believes he's already done plenty that will help him with the transition to the NFL.,0,0,0,0
"Mariota blossomed within Oregon's system, transcended the dual threat quarterback mold and brought the first Heisman Trophy to the University of Oregon.",1,0,0,0
"Monken acknowledged he's not certain how Weeden's game will translate to the NFL, especially because he'll have to play under center and throw under duress.",0,0,0,0
Newton ended up transferring out of Florida though due to allegations of stealing a laptop and possible expulsion due to three instances of academic cheating.,0,0,0,1
"Now Ryan, the so-called transparent coach, is compounding the problem by closing the shutters on his decision-making process on not using Tebow in the Wildcat down the stretch.",0,0,0,0
"On the other hand, he has made untimely mistakes and strange decisions on some passes.",0,1,0,0
"One of the smartest, toughest and most transformational.",0,1,0,0
"Outside of that, he has solid footwork, excellent throwing mechanics and proper weight transfer.",0,0,1,0
"Russell Wilson remains imaginative, shifty, resourceful field general - but that doesn't necessarily translate into automatic double-digit final margins.",1,0,1,0
"If the Bucs want to avoid the 2020 salary cap hit that comes with the franchise and transition tags, they'll have to get creative.",0,0,0,0
"Since transferring from Florida amid allegations that he cheated on classwork, Newton has enjoyed plenty of success on the field.",0,0,0,1
"Sure, the transition from a spread to pro-style offense might take some adjustments.",0,1,0,0
"While Lynch has intriguing strengths, his weaknesses emerged as the season progressed.",0,0,0,0
"The biggest question now is whether the most dynamic quarterback (heck, most dynamic player) in college football during the last two seasons can make a seamless transition to professional football.",1,0,0,0
The muscle tendon then slowly transforms into tissue more closely resembling the native ligament through a fascinating process called ligamentization.,0,0,0,0
"The NFL is a relentless neurotransmitter-hijacking, commodity-pushing pipeline to your brain.",0,0,0,0
The play set up a touchdown pass and was proof that the athleticism which made Mahomes a magician at Texas Tech could translate to the next level.,1,0,0,0
"The power was impressive, but I wish he could have translated it maybe a little better (against live pitching).",0,0,0,0
"The Redskins ran a transitional scheme that incorporated a lot of plays he ran at Baylor - things like zone reads, etc.",1,0,0,0
"The stories, which feature motion-animation transitions between panels, were done in conjunction with DC Comics and feature the creative team of writer Christos Gage and artist Howard Porter.",0,0,0,0
"Then again, the Babylonian captivity didn't last forever, and after 70 years the Jews returned to Israel, transformed, and in some ways stronger than ever.",0,0,0,0
"There are so many variables involved when you transition a QB to the NFL, including coaching, scheme, offensive philosophy, overall team strengths and weaknesses.",0,0,0,0
"This was a tremendous strength of his coming out of college at Cal, and it has transferred to the NFL.",0,0,0,0
Thus 'smarter' as measured by the WPT does not seem to translate into 'better'.,0,1,0,0
"To increase his power, Tebow first needs to focus on transferring his weight more smoothly as he swings.",0,0,0,0
"To understand the importance of not transferring weight on your throw, we need to understand the technical components of throwing the football.",0,0,0,0
Tom Brady's alleged transgressions have nothing to do with the legal system-the NFL has complete responsibility for competitive balance and cheating.,0,0,0,1
"Tranquill, who spent five seasons at Notre Dame, was one of the draft's most mature players.",0,0,0,1
Trask's seamless transformation from little-used reserve into one of the SEC's most efficient quarterbacks has been one of the biggest surprises of the college football season.,0,1,0,0
"Unfortunately for the Bears, that high percentage of downfield throws hasn't translated into consistent success.",0,0,0,0
We were very transparent from the beginning of camp by sitting down with all the quarterbacks and explaining the criteria on which we would base our decision.,0,0,0,0
"When you understand that basic concept and principle, it totally transforms how you think of people and treat people.",0,0,0,0
"With Larry Fitzgerald desperate for a quarterback who can give him more than three or four seasons, Cousins' pro-style offense from Michigan State will transition well.",0,1,0,0
"With what has transpired in free agency thus far, Allen understands why Bills fans are excited that Tom Brady is out of the division and now in Tampa Bay.",0,0,0,0
You've got to just get in there and learn and transition to the speed of the game.,0,1,0,0
"A Rookie of the Year candidate in 2014, he made the leap to Pro Bowler as a sophomore while using his athleticism to take Minnesota to the playoffs.",1,0,0,0
And a slight uptick in really any statistical category would put Baker firmly among the most dangerous QBs in the NFL in his sophomore season.,0,0,0,0
"As a 5-foot-11, 148-pound sophomore, Jones played behind an inexperienced line that protected him as well as an umbrella in a hurricane.",0,0,0,0
But he came back even stronger his second year and arguably played better against Alabama and other teams as a sophomore.,0,0,0,0
"But there's little evidence that the sophomore slump is a thing, and lots of evidence that players consistently get slightly better between their first and second seasons.",0,0,0,0
But Times switched positions to wide receiver after the Bulls' coaching staff realized that their starting sophomore wide receiver - Bridgewater - had a cannon for an arm.,1,0,0,0
Former FSU football quarterback Jameis Winston continues to show all of his leadership skills in his sophomore season with the Tampa Bay Buccaneers.,0,0,1,0
His breakout sophomore year in 2017 showcased his cannon arm and supreme athletic gifts.,1,0,0,0
I don't believe Bradford experienced a sophomore jinx after his stellar rookie year.,0,0,0,0
Lamar Jackson's brilliant sophomore season became historic during Sunday's 24-17 win over the Buffalo Bills.,0,0,0,0
"Nottingham, a sophomore from Alamo, has the stronger arm.",1,0,0,0
"Rising sophomore Justin Holman served as the backup this season, displaying his athleticism and strong arm during limited playing time.",1,0,0,0
"The athletic rookie quarterback had 1,100 rushing yards and 14 rushing touchdowns to go with his 2,786 passing yards and 28 passing touchdowns as a sophomore at North Dakota State.",1,0,0,0
"Watase was a cheerleader while Mariota was the QB at St.  Louis high school, and Watase, who is a year younger, enrolled in Oregon before Mariota's sophomore season.",0,0,0,0
"When you grow up in a homogeneous bubble as I did, empathy doesn't come naturally.",0,0,1,0
Reich has never wavered in his support of Luck's decision to retire from football - even with the quarterback dropping the bombshell two weeks before the 2019 season began.,0,0,0,0
"After being named the winner of the Bears' quarterback competition Sunday, Mitchell Trubisky revealed that he was motivated by the adversity he experienced last season and during the offseason.",0,0,0,0
And the decision by the Bears to trade up for Mitchell Trubisky will ultimately be judged on the results.,0,0,0,0
"As he sits at a Yours Truly restaurant on Center Street, with locals all around him ordering eggs, pancakes, sausage and coffee, Mitchell Trubisky doesn't show any sign of flinching, though.",0,0,0,0
"As Mitchell Trubisky continues to receive harsh criticism for his inconsistent and sometimes downright frustrating play, the struggles have taken a toll on the Bears' third-year quarterback.",0,0,0,0
But one of the biggest bombshells that came out of Friday's presser was that Trubisky changed his mechanics for the first time ever this offseason.,0,0,0,0
But the unlikely runaway leader in tickets and money wagered to win the award is Mitchell Trubisky.,0,0,0,0
"But this was a hellish first Jets-Patriots game and embarrassing flop for Wilson, who the Jets drafted second overall - 13 picks before the Patriots took Jones.",0,0,0,0
"Elijah Mitchell earned his spot on the Top-5 NFL poll in league leaders for rushing yards, with a total of 104 yards and a touchdown in his NFL debut.",0,0,0,0
He's seemingly playing his best football and making great decisions.,0,1,0,0
"He found little room to run against the Chargers' speedy defense that was hellbent on stopping him, and the Ravens' ground game overall was quelled.",0,0,0,0
He has a hell of an arm and is a good scrambler.,1,0,0,0
He is smart as hell.,0,1,0,0
Head coach Matt Nagy's offense-heavy style simply needed developing quarterback Mitchell Trubisky to mature into the force that scouting reports thought he could be.,0,0,0,1
"Hell, it's even stronger.",0,0,0,0
"If he's hellbent on getting back to the NFL, the AAF has much stronger ties.",0,0,0,0
"Instead of having Mitchell run a ""45 Go"" route, which is essentially a 45-yard sprint, he has Mitchell stand 45 yards away and zips passes to that spot.",0,0,0,0
"It's the Mitchell Trubisky show, and about him becoming the leader to carry the team in a consistent manner.",0,0,1,0
"Last week, being that consistent throughout the game versus maybe that shell coverage and it tested us.",0,0,0,0
"Quarterback Mitchell Trubisky continues to come under fire for his erratic performances this season, including Sunday against the Chargers, where he was wildly inconsistent.",0,1,0,0
Quarterback Mitchell Trubisky remains confident that the Bears offense will break out of its slump in Sunday's home game against the Chargers.,0,0,0,0
"Right tackle Mitchell Schwartz told me they demand a lot of Mahomes mentally, especially for such a young player.",0,1,0,0
"The Bears are still developing the talented, but wildly inconsistent Mitchell Trubisky.",0,1,0,0
"The Chargers were feeling pretty confident at the halftime break, but the Texans came out and shellshocked them.",0,0,0,0
The offense got off to a fast start and never looked back with the success of the run game and Bears coaches utilizing Mitchell Trubisky's strengths to the offense's advantage.,0,0,0,0
The trade shocked the NFL world and sent a clear message to current starting quarterback Mitchell Trubisky.,0,0,0,0
This leaves the Titans with one hell of a decision to make moving forward.,0,0,0,0
"To them, the statement may have suggested that Darnold was so shell-shocked that he would invoke supernatural jargon.",0,0,0,0
"With second-year quarterback Mitchell Trubisky also playing well with his 22nd and 23rd touchdown passes of the year, the offense has also shown it can be dangerous.",0,0,0,0
I've had smart guys with no common sense - and they couldn't play.,0,1,0,1
