Sentence,Athletic,Intelligence,Intangibles,Maturity
I think people who are really entrenched in football understand that - that the quarterback gets a lot more of the blame than he deserves.,0,0,0,0
"""I woke up that morning"" - he pauses and grins, a little sheepishly -""not feeling dangerous.""",0,0,0,0
"In open-field rules, players are permitted to use manually-powered vehicles - bicycles, canoes, etc.",0,0,0,0
"In the long run, there are too many weapons there - and Romo too talented - for the power outage to linger.",0,0,0,0
Baker Mayfield is confident he's the man to solve the Browns' 1-31 woes.,0,0,1,0
"Instead, the man known as ""Nuk"" settled for a career-high in receptions - and an emphatic message to the rest of the league.",0,0,0,0
Is not an overly elusive scrambler - struggles escaping the rush and buying a second chance with his feet vs.  pressure.,1,0,0,0
"It was just - we all did, all the coaches, likewise.",0,0,0,0
It will likely take a miracle - and that's one area that Tebow is pretty knowledgeable about.,0,0,0,0
"It's accepted wisdom, but in reality the only way for the game to seem slower to the quarterback is for the quarterback's brain - through repetition and recognition - to accelerate.",0,1,0,0
It's not uncommon to see Mayfield settle for a checkdown rather than gamble.,0,1,0,0
It's notable that none of the players who got work as returners are likely to make the roster purely as receivers - the team will have to make some interesting decisions there.,0,0,0,0
"It's the hidden stuff - the back-end computing power that crunches the numbers and, he hopes, will make UO's teams appear as advanced as the facility they call home.",0,0,0,0
Jared Goff is flying under the radar too - he's the point man for one of the most dangerous offenses in the NFL and they'll get a prime-time shot against the best defense in football on Sunday.,0,0,0,0
"""Johnny didn't understand just how much the Bengals wanted to beat the living s-t out of him,"" the player said.",0,0,0,0
"Later, Rosen created a second post - with a pic of a friend pretending to be punching the damaged part of the car as if he had some superhuman strength.",0,0,0,0
"Lewan - who might have the meanest mean streak of all the O-linemen in this draft - looked athletic in position drills, too.",1,0,0,0
Love is certainly athletic enough to run the read option or even play a little bit of wide receiver.,1,0,0,0
"Manziel showed some glimpses of his playmaking ability, leaving the pocket twice to complete passes - including the touchdown - while also producing scrambles of 11 and 10 yards.",1,0,0,0
"Mostly a tackle at Nevada, the Browns' second-rounder seems to have the perfect athletic temperament to be an NFL guard - aggressive and nasty, but with a focus on outstanding technique.",1,0,0,0
Newton - who ran into a more serious theft situation in his college days - didn't shy away from his decision after the win.,0,0,0,1
Newton also has taken off on more scrambles - runs when a pass play breaks down - than anyone but Wilson over this span.,1,0,0,0
"Nonetheless, Judge offered no regrets on the decision to start Jones - who missed the previous week.",0,0,0,0
"Not only did the Jets get embarrassed 33-0, but Darnold - mic'd up for the game - was mocked for telling coaches on the sideline that he was ""seeing ghosts.",0,0,0,0
"Now, those mechanical tweaks do tend to regress when players get into games - Tim Tebow spent ages improving his mechanics, but every time he'd get into a game, he'd just regress.",0,0,0,0
O'Brien has little choice but to stay ahead of the curve before brilliant defensive minds adjust - as they've done in the past with dual-threat quarterbacks operating in heavily schemed attacks.,1,0,0,0
"Obvously if Rodgers plays, he's tough to sit - even with limited mobility against one of the top-three defenses in the league.",0,0,0,0
"Palmer said the most impressive aspect of Allen's arm strength is the effortlessness - ""easy gas"" as NFL Network draft analyst Daniel Jeremiah calls it.",1,0,0,0
"Polian clarifies by adding that Goff will be asked to do things he's not done before - like calling plays, manipulating defenses, and understanding protections.",0,1,0,0
"Prukop has the intangible, uncoachable ""it"" - instinct, and the weapons, namely arm strength and balance, to back it up.",1,0,1,0
"Reading how Palmer set the pro day up - basically to highlight his strengths and ""address any concerns"" teams might have - is pretty fascinating.",0,0,0,0
"Scheme-wise, how [Stefanski] is coaching it - I think it's going to be a great fit.",0,0,0,0
Seven weeks on the sideline gave Trubisky - an avid reader of leadership books - a more forceful attitude toward what the Bears' offense should be doing when he's in charge.,0,0,1,0
So once I made that decision - too late .,0,0,0,0
"So the turnovers are a byproduct of learning - NFL offense, NFL defenses, NFL people, NFL speed, NFL windows.",0,1,0,0
So why does it seem that both fans and analysts - some of them in really angry fashion - are reluctant to acknowledge this?,0,0,0,0
"Some of his crafty fans discovered the registry of Griffin and Rebecca Liddicoat on the Bed, Bath & Beyond website and decided to send some pre-wedding gifts - lots and lots of them.",0,0,0,0
Some of the best football - and the best versions of bad football - were sent directly into our brainwaves.,0,0,0,0
"Speed, length and athleticism off the edge - those are the skills on the rsum of the top speed rushers in the NFL.",1,0,0,0
"Steve Bisciotti, the team owner, knew that his franchise - forever defined by a bone-crushing defense and a methodical offense - desperately needed a dynamic playmaker on offense.",0,0,0,0
Mayfield has always been an impressive - and aggressive - downfield thrower of the football.,1,0,0,0
That dual threat makes him really hard to play against.,1,0,0,0
That has to do with two attributes in particular - arm strength and mobility.,1,0,0,0
"That high-powered offense - the one featuring quarterback Baker Mayfield and wide receivers Jarvis Landry and Odell Beckham, Jr.  - generated only two touchdowns.",0,0,0,0
"That's fullback speed - or that of a slow linebacker, a position a lot of college coaches felt would've been his best.",1,0,0,0
"The 6-foot-5, 236-pound Bortles often uses his strength and athletic ability to extend plays - and sometimes causes offensive coordinator Nathaniel Hackett's stomach to drop during games.",1,0,0,0
"The belief that these decisions aren't always made for pure football reasons - or by the purely football guys, like Flores, who nonetheless have to wear it - can create dissension.",0,0,0,0
The Broncos need a starting-caliber quarterback - otherwise they'll continue to waste their defense's immense talent.,0,0,0,0
The Bucs' big day - with Winston as their new quarterback - backfired like one of the pirate ship cannons housed behind one of the stadium's end zones.,0,0,0,0
"The competitor mentality - I was just like, 'Hey, I gotta finish this drive before I leave the game.",0,0,1,0
"The Eagles' next three games are against the Seahawks (7-3), Green Bay Packers (7-3), and New Orleans Saints (8-2) - all division leaders in the NFC.",0,0,0,0
The idea is to assemble enough information - numerical and anecdotal - to create a prediction in which they feel 70% confident.,0,0,0,0
The modification process is probably the most important part of getting a rookie QB ready to play - the coaches need to fully identify Haskins' strengths and weaknesses.,0,0,0,0
"The natural gifts - size, arm strength, etc.",1,0,0,0
"The neutral-toned bathroom has a bit of whimsy with tiling that evokes zebra stripes-but otherwise, the penthouse's design is serious, clean, and oh-so-luxurious.",0,0,0,0
"The same qualities Newton possessed were those James used to dominate the league - size, strength, power.",1,0,0,0
The third-year quarterback had a recurring ankle injury that hampered him all season - especially when the Chiefs experienced a two-game skid against the Indianapolis Colts and Houston Texans.,0,0,0,0
Their running game is taking off - it's currently fourth in the NFL - but they're almost dead last in passing yards per game.,0,0,0,0
"There are some things, fundamentally, that he has to understand - taking care of ball basic stuff.",0,1,0,0
They were smart to pass - at least in the first round - but thinking Fitzpatrick was the long-term answer also was wrong.,0,0,0,0
This is the first time is has been publicly acknowledged that Luck is throwing footballs - regardless of size - since his initial attempt to return from the injury in October.,0,0,0,0
"To me, I am totally on board with BA's spread 0 RB offense in passing situations--if the QB is mobile--but not if the QB is stationary.",1,0,0,0
"Too often he looks like a robot as a passer, can be overly cautious and doesn't consistently hit his targets in stride - especially under pressure.",0,0,1,0
Try to imagine being 24 years old and - because of your athletic gifts - finding yourself the public face of a multibillion-dollar company.,1,0,0,0
"Vaitai, Tavai and Shelton saw what Ngata - who did not return messages for this story - accomplished as a five-time Pro Bowl defensive tackle and a Super Bowl champion.",0,0,0,0
"We always have talks - coach (Ron) Rivera and I, as well as Mr.  (Dave) Gettleman - about playing smart and being smart when I'm on the field.",0,1,0,0
"We want to be the best offense to touch the field in the world, consistently - play in, play out, series in, series out.",0,0,0,0
Allen is more physically gifted - especially when it comes to raw arm talent.,1,0,0,0
Wentz was a better decision-maker and more mature at this same point.,0,1,0,1
Wentz's progress - beginning this season - will serve as the measuring stick for Roseman's return to power.,0,0,0,0
"When the 3-3 Eagles visit Sunday night, they will find a Cowboys team whose botched assignments, dumb penalties, and dropped passes - according to profootballfocus.",0,1,0,0
"When we have to be great at the precision passing game, it's just about us being more consistent in doing that - being on time with the ball, having the right depths of the routes,"" Kingsbury said.",0,0,0,0
Which of the athletic quarterbacks would thrive receiving - rather than throwing - the football?,1,0,0,0
You watch him in the wind sprints - he never gives up.,0,0,1,0
"After Thursday's NFL Draft, the 33-year-old former Utah State wide receiver-turned-strength/speed coach will have trained the top two overall picks in each of the past two drafts.",0,0,0,0
"Although Gabbert has failed to live up to his draft status, he has found limited success in the NFL and would provide some veteran leadership/experience to the position.",0,0,1,0
"As I've written a million times, your ultimate success comes down to 75-80 percent intangibles/leadership/charisma/personality/brains/work ethic and 20-25 percent talent.",0,1,1,0
"B/R Mag is an experimental, multiplatform digital sports magazine from Bleacher Report.",0,0,0,0
"Blessed/cursed with an uncanny resemblance to Peter Griffin, Franzese went around the nerd convention completely in character - and he was brilliant at it.",0,0,0,0
"But because QBs have become so much more efficient, it means that they can throw 500 times and not sacrifice as much in rate stats like Y/A and completion percentage.",0,0,0,0
But Henne struggled through the first 2 1/2 games and the decision was made to insert Bortles into the starting lineup and let him now learn on the fly.,0,0,0,0
"But the bad decisions, errant tosses, and panicky play inside/outside the pocket was there too, and we didn't see much of that during his rookie season.",0,1,1,0
"But with where everyone stands today, the Bucs would be wise to trade down and stockpile draft picks and/or players, or take a shot with Mariota.",0,0,0,0
"And because his scrambling can be a thing a beauty, this run and throw flat out crushed.",1,0,0,0
Couldn't adjust on/off speed.,0,0,0,0
"Earlier this week he posted his support for Black Lives Matter, complete with more information on how to donate, sign petitions, text/call local leaders, (and) learn more about these issues.",0,0,0,0
"Extreme arm strength may inhibit growth/anticipation as a quarterback, and may hide deficiencies as a prospect.",1,0,0,0
"Fans want to see a big Carson Wentz / Jared Goff like jump in play from Trubisky in year two, and the Bears are doing everything in their power to ensure that happens.",0,0,0,0
"Finebaum - who, along with Spears, made the decision to part ways with the show, per the report - will continue with his radio/TV show.",0,0,0,0
"For instance, the 2013/14 Seahawks were led by a dominant defense that consistently held opponents to fewer than 20 points and yielded minimal yardage on the ground.",0,0,0,0
"For this experiment, I'm pitting Moore against Vince Young, considered one of the most elusive quarterbacks/athletes in college football history.",1,0,0,0
"Griffin can also play/think a little too fast, leaving the pocket prematurely and generally lacking a deliberate manner to his game.",0,0,1,0
"Harbaugh said any player's return to practice from the reserve/COVID-19 list would be ""medical decisions, in the end, not coaching decisions.",0,0,0,0
"Haskins called his draft decision ""50/50"" after leading the Buckeyes to a Rose Bowl victory over Washington, but Fields' move would indicate Haskins is on his way out of Columbus.",0,0,0,0
"He also measured in at 6-0 1/2 and 200 pounds, and that size/speed combo is going to excite teams looking for bigger corners.",1,0,0,0
"He didn't have to go through a full progression, and he had a tendency to have periods when he forced some throws and/or makes some poor decisions.",0,1,0,0
"He does some of those zone reads where they incorporate a pass/run option, different things.",1,0,0,0
"He was the president of NFL Europe, the general manager of the MLS's Houston Dynamo, the athletic director of his alma mater and is now the CEO/commissioner of the XFL.",0,0,0,0
"He's also proficient throwing on the run, as he possesses the athleticism and body awareness to pull the ball up, square his hips/shoulders, and make a mechanically effective throw.",1,0,0,0
He's trying to get a licensing agreement to sell some merchandise there and hopes to collaborate with some mental health charities around the Bryan/College Station areas.,0,0,0,0
"His footwork, like many spread and/or dual-threat passers, is far from textbook.",1,0,0,0
"Manuel has been a great leader, securing buy-in from his teammates and exhibiting great toughness playing through injuries, including a broken leg in a bowl game.",0,0,1,0
It's so important to consistently get a good night's sleep when training/playing in order to make gains.,0,0,0,0
"Jadeveon Clowney (6-foot-4 1/2, 260 pounds) did not play well this season, but he is an outstanding athlete with speed and has great talent.",1,0,0,0
"Lacks ideal power and has remarkably small hands - measured only 8 3/4 inches, which you might normally find with slot receivers, punt returners and nickel corners.",1,0,0,0
"Lastly, Riley's system was/is the most creative in all of college football with wild misdirection and RPOs galore, and he ran it in a conference with a reputation of porous defense.",0,0,0,0
Linebacker Tanner Muse was likewise placed on the reserve/injured list.,0,0,0,0
"Manuel can fire the ball into passing windows at all levels of the field, and throws a good deep ball.",1,0,0,0
"Maybe most importantly at this time of year - at least for some - is that injuries have a major impact on fantasy football rankings, fantasy football free-agent strategy and start/sit decisions.",0,0,0,0
My business partners and colleagues have grown and matured in our own ways beyond the occasionally rowdy college news / sports / culture blog we once were.,0,0,0,0
"On Tuesday, Chiefs team president Mark Donovan called Arrowhead Stadium's setup the ""most efficient voting/polling station"" that he'd ever been to.",0,0,0,0
"Quickly find the free-agent gems, pull the trigger on the perfect trade & make the right start/sit decisions.",0,0,0,0
"Scott Crichton (6-foot-2 1/2, 262 pounds) is undersized but never stops working and is very athletic; he played tight end in high school.",1,0,0,0
Several folks have asked me how I feel about the Foles/Wentz dynamic.,0,0,0,0
"So are those figures a case of system playing against him, receivers not being good enough or Teddy not being confident/capable?",0,0,1,0
"Some very smart commenter on the QBOPS post pointed out that when you combine completion percentage with Y/A, you end up double counting incompletions.",0,0,0,0
The Broncos won't have returner Spencer (COVID-19/reserve list) and special teams play-time leader Trey Marshall (shin) Sunday against New Orleans.,0,0,0,0
"The drop-off in Y/C is notable, but generally speaking Bradford was the same consistent, conservative QB all year.",0,1,0,0
"The latter's mistakes do not strike me so much as poor reads or panic so much as just overconfidence in his arm, which is strong but not in the Brett Favre/gunslinger sense.",1,1,1,0
The most likely plan is to start him on the reserve/physically unable to perform list and reevaluate in October.,0,0,0,0
"The most logical scenario has long been that he opens the season on the reserve/physically unable to perform list, allowing the team to re-evaluate his progress in October.",0,0,0,0
"The Packers quarterback revealed that he was actually dangerously close to choosing retirement over returning, placing the odds at 50/50 before ultimately deciding to come back.",0,0,0,0
The scheme was not only predicated on downhill runs/play-action but also sprinkled in creative ways to use the quarterback as a runner and even occasionally as a receiver.,1,0,0,0
The sporadic breakdown of his mechanics/footwork will cause him to lose some zip on his passes.,0,0,0,0
"Then by late February/early March I introduce high-intensity cardio, such as footwork and plyometrics to improve speed and agility, as well as resistance training to build strength for the season.",0,0,0,0
"They stand to be released, allowed to leave as free agents or relegated to backup status because of inconsistent/poor performances, money issues, health concerns or age.",0,0,0,0
This decision could simply come down to whether Nick Foles bruised/sprained glute/hip or Trubisky's right shoulder has healed the most by Monday.,0,0,0,0
This was the first team work he has done after being activated from the physically unable to perform list Thursday with an Achilles/heel injury.,0,0,0,0
This week marks the one year anniversary of the Jets making the fateful decision to trade for part-time quarterback/full-time proselytizer Tim Tebow.,0,0,0,0
"To be sure, anyone with even a cursory knowledge of history (Montana-Young/Favre-Rodgers) knows these situations don't often play out like an after-school special.",0,0,0,0
"Together, Trubisky and Jordan Howard / Tarik Cohen form a dangerous duo down near the goal line.",0,0,0,0
"Unfortunately, the power-hungry coach/GM has compromised his best player's career.",0,0,0,0
"When you have a tight end/defensive end kind of body back there, really mobile moving around, can really play strength and he can throw the ball down the field.",1,0,0,0
"While at Reedly, Allen grew two inches and put on muscle, putting him at 6'5/210lbs.",1,0,0,0
"While most teammates stood around, stretched and talked before taking the field, Griffin ran himself through a round of warmup passing/footwork drills with an invisible ball.",0,0,0,0
"Winston's had the chance to play in a hybrid/pro-style offense at Florida State and has shown he can adroitly make all the reads, throw accurately to spots or extend plays with his legs.",1,1,0,0
"With RGIII also showing promise as a passer on the move to either side, he is definitely worth a look as a developmental/backup option.",1,0,0,0
"Combine the accuracy and intelligence of Manning or Rivers, along with the improvisational skills of Roethlisberger, and you might just have the perfect 2012 NFL quarterback.",0,1,1,0
"Combine those statistics with his eight fumbles, and inability to make a read, decision, or throw the ball away instead of taking a 10-yard sack or running straight out-of-bounds.",0,1,0,0
"Come in with the same mindset, the same work ethic, the same attitude so your teammates see that on a consistent basis.",0,0,1,0
Defensive end Robert Quinn took part in the team drills as he attempts to return to full strength after back surgery.,0,0,0,0
"What separates Lynch from big, stiff signal-callers such as Flacco and Ryan Mallett is his athleticism.",1,0,0,0
"Coming from a wildly different offense at Memphis to this one - where the tempo is faster, the guys stronger and the playbook much more complex - you're going to have to be a little more patient.",0,0,0,0
"Coming into that particular crucible on Sunday is Chargers rookie Justin Herbert, who has impressed this season far beyond what most draft analysts (this particular genius included) expected.",0,0,0,0
"Coming into the league, many questioned his ability to throw accurately consistently.",0,0,0,0
"Coming into the season, Chubb's biggest concern was the usage of his running mate, Kareem Hunt.",0,0,0,0
"Coming off a suspenseful win against the Detroit Lions for the season opener, the 49ers need to be ready for the Eagles dynamic offense that features Jalen Hurts and DeVonta Smith.",0,0,0,0
"Coming off the highs of the past three weeks, Newton feels confident heading into the final game of his rookie year.",0,0,0,0
"Coming out of college, we knew Mariota had a cannon and used his legs well.",1,0,0,0
He made quick decisions with the ball in Chip Kelly's spread offense.,0,1,0,0
"Coming out of FCS powerhouse North Dakota State, it seemed like a huge stretch to take such a huge risk on him in the first place.",0,0,0,0
"Coming out of Indianapolis, two elite quarterback prospects stand out - Robert Griffin III and Andrew Luck - for their remarkable overall skills, intelligence and intangibles.",0,1,1,0
Coming to train behind one of the best quarterbacks ever may have been one of Winston's smartest moves.,0,1,0,0
Committed to the idea of making a better Maryland and then that changed and that's why I had to change my decision.,0,0,0,0
Communication breakdown or misunderstanding?,0,0,0,0
Compare that to 18 hits on 50 scrambles beyond the line of scrimmage on passing plays and 85 hits on 423 plays when in the pocket or behind the line of scrimmage.,0,0,0,0
"Compare that to Deshaun Watson, who has great mechanics:High elbow, no stress.",0,0,0,0
Compare that with Jameis Winston's speed.,1,0,0,0
"Compared to a gunslinger like Brett Favre, Mahomes can make wow throws, but also gets in trouble with poor mechanics and throwing into space.",1,1,0,0
"Compared to the other quarterbacks at the combine, Ponder's arm strength is about average.",1,0,0,0
"Comparison:The claim could be made that as far as the passing game goes, Newton has already surpassed Tebow in pure ability and throwing mechanics.",0,0,0,0
"Competition is an integral part of the NFL, and Tennessee Titans quarterback Marcus Mariota does not appear phased by the team's decision to trade for Ryan Tannehill this offseason.",0,0,0,1
"""Completely my decision,"" Rivera said.",0,0,0,0
"At this time, we have decided that the best decision to reach the goal of bringing the foot back to 100 percent is to place Cam on injured reserve.",0,0,0,0
But it is the right decision for me.,0,0,0,0
Every year difficult decisions are made and they are never easy.,0,0,0,0
He's a very smart player.,0,1,0,0
He's athletic.,1,0,0,0
He's smart.,0,1,0,0
Honestly it's the hardest decision of my life.,0,0,0,0
I feel like you're a stupid person if you continue to make the same wrong decisions.,0,1,0,0
I think there are a lot of emotions to the game and I certainly understand that.,0,0,0,0
I totally understand that I'm like the scapegoat for this team.,0,0,0,0
I understand that.,0,0,0,0
I went between so the guy wouldn't do anything stupid and that was the end of it.,0,1,0,0
Immature and has had issues with authority.,0,0,0,1
Otherwise the termination will become permanent.,0,0,0,0
"She joins ""CBS Mornings"" to talk about her book, which uses behavioral science to give people tools to improve decision making when it comes to dating.",0,0,0,0
That's a strength that he has.,0,0,0,0
That's a stupid draft pick to me.,0,0,0,0
"The mental side of it, he's got to dominate.",0,1,0,0
"These conditions, while extensive and exacting, remain confidential.",0,0,0,0
"They are fearless, but they avoid being reckless.",0,1,1,0
This is not an easy decision.,0,0,0,0
We continually stress to all of our players the importance of sound decision making in an effort to avoid putting themselves in these types of situations.,0,1,0,1
When you need precision decision making you can't count on a black quarterback.,0,1,0,0
"While it may be technically possible, saving Earth from a ""planet killer"" asteroid or comet would require very quick action by world leaders.",0,0,0,0
"""I don't have a suit collection for nothing,"" he jokes, noting that Essence's ""elegant and confident"" profile requires similar attire.",0,0,0,0
"A 6'5"", 230-pounder with a cannon arm and great athleticism, he has all of the tools to be solid starting NFL field general.",1,0,0,0
"A better person, brother, son, football player, friend, businessman, community leader.",0,0,0,1
"A big nod to our esteemed stat guy, Bill ""Sudsy"" Sudell for the knowledge.",0,0,0,0
"A big part of leadership is being competent at what you're doing, being good at it.",0,0,1,0
A bit behind tight end Luke Stocker on a crafty play-action pass that should have scored.,0,1,0,0
