Sentence,Athletic,Intelligence,Intangibles,Maturity
"Added Rosen: ""It may have been a little dicey, but I probably should've been smarter with that even though this one worked out.",0,1,0,0
Adding better pieces through free agency and the draft to help Ponder is the best decision the Vikings can make.,0,0,0,0
Adding more time to the play would have just allowed him to run longer at his impressive top speed.,1,0,0,0
Addison Luck volunteered on behalf of the Morgantown Hi-Y community service club and the Mountain Institute environmental conservation group.,0,0,0,0
"Additionally, Goff has risen up that leaderboard only recently.",0,0,0,0
"Additionally, Haskins mechanics could use some work.",0,0,0,0
"Additionally, he has the quickness and footwork to deal with both interior and exterior pressure.",1,0,0,0
"Additionally, he took two hits, got up, and looked confident getting back in the huddle.",0,0,1,0
"Additionally, he's going to continue to get stronger and his arm strength should improve along the way.",1,0,0,0
"Additionally, his athleticism will allow the Titans to continue selling some of Mariota's run-fakes and play action calls with some sort of legitimacy.",1,0,0,0
"Additionally, the expansion will help to honor local sports legends and their athletic teams respectively.",0,0,0,0
"Additionally, Theismann questioned the leadership of the rookie.",0,0,1,0
"Adjusting to the speed of the game, seeing it, and experiencing it, has been really helpful.",0,0,0,0
"Advanced statistics and a better understanding of how first downs, and points, are gained have shifted the game more and more away from run-centered offenses.",0,0,0,0
"Vince Young used to be a leader, but then he went on to the NFL.",0,0,1,0
"After 10 games with St.  Louis, he lost the starting job to Case freaking Keenum.",0,0,0,0
"After a 2012 season that had as many winces as wows, RG3's vow to be smarter about scrambling will be tested in the Monday night opener.",1,1,0,0
"After a barrage of criticism about his turnovers, Manning threw a meaningless interception against Green Bay but completed 21 of 29 passes for 340 yards in an otherwise crisp showing.",0,1,0,0
"After a brilliant start to the season, Newton seemed to a hit a wall and struggled for the second half of his rookie campaign.",0,0,0,0
"After a dominating performance, however, it turned out to be a terrific decision that guarantees him the top spot ahead of fellow quarterback Robert Griffin III.",0,0,0,0
"After a few bad plays against Cincinnati, the decision to let Hodges take a run at the offense was a no brainer.",0,0,0,0
"After a full offseason with his wide receivers and other teammates, Gabbert should come out much more prepared and confident.",0,0,1,0
"After a lackluster NFL debut, Tagovailoa opened it up Sunday vs.  the Arizona Cardinals, unleashing a dynamite deep ball and flashing impressive mobility.",1,0,0,0
"After a largely inconsistent start to camp, LaFleur said the first-round pick was sharp.",0,0,0,0
"After a long time off the field because of injury, Bradford's play has been very inconsistent through seven games.",0,0,0,0
"After a Rookie of the Year campaign in 2010, he experienced a myriad of ups and downs over the next few seasons.",0,0,0,0
"After a series of struggles at Ohio State, Pryor entered the NFL's supplemental draft two years ago.",0,0,0,0
"After a stunning 11-5 season in Luck's rookie season and with more than $34 million in dead money from the 2012 cap off the books, Grigson had money to spend in 2013 and did not spend wisely.",0,0,0,0
"After a thorough evaluation of the quarterback position we've come to the decision that Ryan Tannehill is our starting quarterback,"" Philbin read from a prepared statement.",0,0,0,0
"After a week of speculation that Tim Tebow and Jana Duggar could be the next Hollywood power couple, RadarOnline.",0,0,0,0
"After all he's experienced since leaving home, he's still pretty much the same low-key Oviedo guy.",0,0,0,0
"After all Luck has been through, it's understandable.",0,0,0,0
"After all that, Tannehill is back in command in Miami-not that he ever wasn't.",0,0,0,0
"After all, he is one of the team leaders.",0,0,1,0
"After all, his rookie contract was nearly up and it wasn't nearly as detrimental to the cap situation here.",0,0,0,0
"After all, how can you justify extending a quarterback who has been so inconsistent on the field and bone-headed off of it.",0,1,0,1
"After all, Rosen was coming off a wet fart of a rookie year and consistently invoked feelings of, at best, ""meh, that guy.",0,0,0,0
"After all, the Browns had hoped that Manziel would be the franchise quarterback and that involves showing leadership and maturity.",0,0,1,1
"After all, the last regular season was decent with a 13-3 record in NFC North, and Aaron Rodgers will still be around to power the team along again next time out.",0,0,0,0
"After all, the team's offense was one of the most ruthless and dangerous offenses in the NFL because the offensive linemen imposed their will upon defenses.",0,0,0,0
"After all, this is the franchise that knows how to provide mirth to an otherwise dour sport.",0,0,0,0
"After an embarrassing home loss to the St.  Louis Rams in Week 9, the Colts traveled to Tennessee to take on a rising Titans team trying to take control of the AFC South on Thursday Night Football.",0,0,0,0
"After an outstanding season in his first year in the NFL, he just missed the playoffs with a rebuilding team, which is a credit to his leadership and winning attitude.",0,0,1,0
"After an unacceptable 31-13 loss to the Minnesota Vikings, the evaluation period has begun for the Panthers, whether or not head coach Ron Rivera wants to accept that fact.",0,0,0,0
"After being highly criticized for this throwing mechanics, among other things, Tebow was later traded to the New York Jets where he sat on the sideline the entire season.",0,0,0,0
"After being in the NFL for six years, he still has not progressed on his throwing mechanics.",0,0,0,0
"After being tormented by the Tom Brady era, New York had hopes that this contest could be the mark of a change in power.",0,0,0,0
"After Brown jogged off the field shirtless in the middle of a game, some speculated he had mental health issues or suffered from CTE.",0,0,0,0
"After connecting with Devin Funchess for a 4-yard touchdown, Newton was confident knowing that Carolina would get the ball to begin the third quarter.",0,0,0,0
"After engineering a touchdown drive in Kelly's fast-break offense, he reached the sideline and displayed QB1 leadership.",0,0,1,0
"After every hit, Manning got up unbothered and responded with a clutch throw on the next play.",0,0,1,0
After failing to heal naturally following the season Newton opted to have surgery.,0,0,0,0
"After falling behind by double digits in the second quarter, Murray scored a 12-yard rushing touchdown and fired a scrambling 77-yard TD strike to Rondale Moore on consecutive possessions.",1,0,0,0
"After getting embarrassed by Northwestern's defense last Saturday, Taulia took his anger out on the Gophers defense on Friday night.",0,0,0,0
"After getting the corners to back off, Newton has more room to work with on the outside, which makes him dangerous.",0,0,0,0
"After his 29-yard sprint to beat the Baltimore Ravens on Sunday, Henry now has two overtime touchdowns on the season.",1,0,0,0
"After his retirement, he had amnesia, dementia, depression, and acute bone and muscle pain.",0,0,0,0
"After his rookie campaign, the Redskins looked like geniuses for giving up all of those assets to acquire Griffin.",0,0,0,0
"After Hunt's message, evangelist and CityFest leader Andrew Palau spoke of the importance of having a life with God.",0,0,0,0
"After interviewing the driver and Winston, among others, Jones found the Uber driver's account to be ""consistent and credible,"" according to the league's press release.",0,0,0,0
"After last season, Goff joined Brees at the Pro Bowl on the NFC roster, picking his brain on and off the field.",0,1,0,0
"After much discussion with my family and coaches, I have made the decision to take the next step in my career and enter the 2018 NFL draft.",0,0,0,0
"After not missing a game during his first three seasons, Luck missed nine games in 2015 after sustaining a sprained shoulder, a lacerated kidney and a partially torn abdominal muscle.",0,0,0,0
"After one season in the NFL, Haskins answered that he's got way more mobility than most expected.",1,0,0,0
"After opening the season with an 11-1 start, New York has struggled mightily, going 22-48 since and sinking 14 games behind NL East leader Atlanta.",0,0,0,0
"After praising his skill and intelligence on the field, the veteran coach told Sports Illustrated's King that Rosen lacks a ""blue-collar, gritty attitude.",0,1,1,0
"After Ramsey's message, Allen said in August that he didn't care.",0,0,0,0
After reading many letters and messages.,0,0,0,0
"After receiving just one impressive start as a rookie, Mahomes showed the maturity of a veteran by reading coverages and looking off defenders.",0,1,0,1
"After RGIII's dynamic rookie season in which he led the Redskins to the playoffs for the first time in five seasons, Griffin suffered a devastating knee injury.",0,0,0,0
"After scrambling in the backfield trying to find a receiver, Mahomes threw a dart to Travis Kelce to the right side of the field while Mahomes was running left.",1,0,0,0
"After seeing Delang's jersey, Tebow joked: ""I almost switched this message to repentance.",0,0,0,0
"After several minutes down on the turf being tended to by athletic trainers and team doctors, Ivory was taken to the locker room.",0,0,0,0
"After showing off elite arm strength in college, Allen's accuracy and ball placement have improved dramatically this season.",1,1,0,0
"After six Organized Team Activities practices, coaches and teammates have been impressed by his command of the offense and mobility.",1,0,1,0
"After six years, we can say pretty confidently that neither team really won this trade.",0,0,0,0
"After some early struggles against Carolina, Denver's defense partied like it was early 2016 in the Panther backfield, knocking Cam Newton senseless.",0,0,0,0
"After struggling in Washington and seeing his time there end prematurely, Haskins is focused less on expectation and more on getting comfortable with his second NFL team.",0,0,0,0
"After studying the aforementioned three games, I can confidently state that Lance is off the charts in all five areas.",0,0,0,0
"After suffering a concussion in Week 5 against Atlanta, Griffin improved his decision-making when on the run.",0,1,0,0
"After taking off only three times in the first two games, Wentz has 16 rushing attempts in the last two.",1,0,0,0
"After that day, my leader in the clubhouse was the Ravens.",0,0,0,0
"After that, the Buccaneers will need to make a decision about his future.",0,0,0,0
"After that, the decision rests with the team's athletic trainers and other parties within the organization.",0,0,0,0
"After the 2017 season is over, which will be in two weeks for the Dolphins, Miami will start making changes to their roster and decisions for their future.",0,0,0,0
"After the AFC divisional round upset, the Colts held bragging rights on horsepower.",0,0,0,0
"After the David Garrard debacle, the Jaguars' fans morale was already at a new found low but wanted to trust what the team believed was the best direction to take the franchise.",0,0,0,0
"After the Eagles concluded the 2016 season with a win over the Dallas Cowboys on New Year's Day, head coach Doug Pederson had a simple message for quarterback Carson Wentz.",0,0,0,0
"After the fundamentals, there's an obvious lack of confidence,"" adds Takeo.",0,0,1,0
"After the game, he talked about his decision.",0,0,0,0
"After the game, Lawrence told the media that he was disappointed by the loss, but understood that the team had to focus on the next big task in the Denver Broncos.",0,0,0,0
"After the game, Newton said he stood by Rivera's decision.",0,0,0,0
"After the game, Teddy shared a heartfelt message with his team.",0,0,0,0
After the glove debacle Mike Mayock became the biggest critic of Bridgewater and the leader of the Teddy to the Second Round Crusade.,0,0,0,0
"After the loss, Panthers head coach Ron Rivera said in the postgame presser his message to his team was simple-move on.",0,0,0,0
"After the meeting, Bush was highlighted, saying he wants to be a leader on this team and that he has a lot to teach the younger players.",0,0,1,0
"After the Panthers lost to the Seattle Seahawks, 40-7, Newton stood by head coach Ron Rivera's decision to bench him for breaking the team's rule.",0,0,0,0
"After the same knee buckled during practice last week, that decision seemed to prove costly.",0,0,0,0
"After the suspension was levied, Winston issued a statement of his own, claiming that the incident was part of a stretch of life experiences that have helped him ""grow, mature, and learn.",0,0,0,1
"After the Titans started 2-4, head coach Mike Vrabel made the decision to bench Mariota for Tannehill.",0,0,0,0
"After the Week 2 manhandling to the New York football Jets, the team put in a young (21 years old at the time), inexperienced Gabbert to take the role of leader on the offense.",0,0,1,0
"After the Week 3 loss to the Chiefs, however, Lazor got wise to his quarterback's abilities.",0,0,0,0
"After three seasons, I feel like I've watched and played enough pro football to be an authority on the league's smartest quarterbacks.",0,1,0,0
"After trading for quarterback Alex Smith in the offseason and signing running back Adrian Peterson last month, Washington hoped to have an effective and efficient offense.",0,0,0,0
"After two years in the league and already about to enter his third team, this is a mess Pittsburgh would be wise to avoid.",0,0,0,0
"After weeks of inconsistent play, the Tennessee Titans have made the decision to bench quarterback Marcus Mariota.",0,0,0,0
"After winning the Heisman Trophy, according to sources, he was outperformed by Newton in practice, yet Tebow (understandably) remained the starter.",0,0,0,0
"After years of dodging the magnitude of what football does to its players, there is at least some acknowledgement of the dangers and permanent damage thanks to studies and lawsuits.",0,0,0,0
"After years of trying, the Redskins hope they finally have landed a dynamic player at the sport's most important position who can help rekindle the franchise's past success.",1,0,0,0
"Afterward, Newton came off as sulky and immature.",0,0,0,1
"Again, (the officials) are trying to judge it full speed.",0,0,0,0
"Again, at the end of the day it's going to be the decision by the head coach (Shurmur) as to when or if Daniel ends up playing this year.",0,0,0,0
"Again, he's smart.",0,1,0,0
"Again, his footwork is going to be key.",0,0,0,0
"Again, I would just say it was the decision that we thought was best for this team.",0,0,0,0
"Again, I'm very self-driven and I understand things could've went differently.",0,0,0,0
"Again, it's being smart and efficient in a timing offense.",0,1,0,0
"Again, it's Day One, but very pleased with his demeanor, execution and decision-making.",0,1,0,0
"Again, this is not to say he's a competent NFL quarterback - that would be an irresponsible claim at this point.",0,1,0,0
"Again, we got out to an early start, 14 points, got a little stagnant there and wanted to try to spark the time, and that's the reason why I made that decision.",0,0,0,0
"Again, you're never a finished product, and having good feet leads to good accuracy, and I just want to continue to get more and more consistent with that.",0,0,0,0
"Against a better team, it's unlikely the Bills would have survived some of his miscues and decisions.",0,1,0,0
"Against Cleveland, RG3 completed six of eight passes for 112 yards and ran four times for 24 more, including an 18-yard scramble.",1,0,0,0
"Against less mobile passers in Fitzpatrick and Heinicke, Bosa's penetration from left end helped get the Chargers defense off the field numerous times.",1,0,0,0
"Against Miami's Cover Two, he rockets a pass past the linebacker and completes it before the safety can deliver his raucous hit.",1,0,0,0
"Against Tampa Bay for example, Griffin took off running and gained 15 yards on a late drive leading to a winning field goal - a celebrated play.",1,0,0,0
"Against the Baltimore Ravens last Sunday, Jones moved better but scrambled just once for 3 yards.",1,0,0,0
"Against the pass, the Colts are consistently keeping the ball in front of the defense and quickly rallying to tackle receivers after the catch.",0,0,0,0
Age and a poor showing in the AAF could have played a factor in the XFL coaches' decisions to pass on Richardson.,0,0,0,0
Auburn's argument over Newton focused on its claims that Rogers wasn't an agent and Newton's lack knowledge of his father's actions.,0,0,0,0
"Aggressiveness is a great trait, but only if it eventually meets up with maturity.",0,0,1,1
"Ah yes, his athleticism.",1,0,0,0
"Ahead of Sunday's matchup against the Houston Texans, the Bears QB understands comparisons will be made between his struggles and the star turn of draft classmate Deshaun Watson.",0,0,0,0
Alabama coach Nick Saban said Watson isn't one of those athletic quarterbacks you just have to worry about running around and keeping plays alive.,1,0,0,0
"Alabama lost out, but the decision was tougher than thought for the young quarterback.",0,0,0,0
"Alabama's Courtney Upshaw gets more publicity, but this week in Mobile, Ingram showed that he is the more explosive and athletic prospect.",1,0,0,0
"Alderson, a former Marine officer, said the Mets had no problem accommodating Tebow's television work and said he was impressed with Tebow's leadership skills, competitiveness and character.",0,0,0,0
"Alex is so far advanced from the mental side of things in regards to his ability to read coverages, to shift to better plays and really play the chess game.",0,1,0,0
"Alex Smith's days as the Kansas City Chiefs unquestioned starter are numbered, and they can feel confident knowing that Patrick Mahomes has a good chance of being 'the guy'.",0,0,0,0
"Alex, who has been here, is a really sharp guy mentally.",0,1,0,0
"Alexander has consistently ranked among the top NFL special teams tacklers, but has been overlooked in part because of the Redskins' losing record in previous years.",0,0,0,0
"All afternoon, Lawrence struggled with accuracy, even on easy throws, and did not handle pressure - by making smart decisions while under duress - for most of the outing.",0,1,0,0
"All due respect to Fitzpatrick, the Dolphins will most likely regret their decision to start the new season off with the veteran over Rosen, and here are three reasons to back the claim up.",0,0,0,0
All emails are subject to publication unless specified otherwise.,0,0,0,0
All he can do is keep working with House and get his reps in so he can build muscle memory and confidence heading into a crucial 2017 season.,0,0,0,0
All I can remember was that cannon going off (after every Winnipeg scoring play).,0,0,0,0
"All in all, Denver probably has the better roster and a more experienced coaching staff.",0,0,0,0
"All in all, the Broncos would be wise to inquire about Bridgewater's services for a backup job.",0,0,0,0
"All of that made the decision difficult, and a return to college would have put him in that rarified class that includes Tennessee's Peyton Manning, USC's Matt Leinart and Florida's Tim Tebow.",0,0,0,0
All of that might make it difficult to frame a story about Winston's newly developed strength of character.,0,0,0,1
"All of that seemed like an eternity ago for both the Bills and Jaguars, two teams with good defense who are atrocious at football otherwise.",0,0,0,0
All of the comments are probably coming from selfish people only looking to make a profit off the sport.,0,0,0,0
All of these figures are reasonable improvements for a player who is poised to take a monumental step forward.,0,0,0,0
All of these injuries appeared to play a significant role in Luck's decision to retire so early.,0,0,0,0
All of those dynamics help make the situation what it is.,0,0,0,0
All quarterbacks make tweaks to generate the power needed for different throws.,0,0,0,0
"All quotes obtained firsthand by Brent Sobleski, who covers the NFL draft for Bleacher Report, unless otherwise noted.",0,0,0,0
All quotes obtained firsthand unless otherwise stated.,0,0,0,0
"All season, Newton's ability to throw from the pocket has proved to be erratic.",0,1,0,0
"When we played Peyton in the preseason, I found a new appreciation for the way he makes adjustments at the line of scrimmage; he controls the protections, and if he sees the blitz coming he slides it.",0,1,0,0
Nobody else has both the authority to change plays like that within their offense and the understanding to know when its appropriate.,0,1,0,0
He makes incredible adjustments during the game.,0,1,0,0
He can identify defenses and he really spreads the ball out to some great receivers.,0,1,0,0
Some of that is about intelligence: Watching film and knowing where the defense likes to attack.,0,1,0,0
"He has a tremendous understanding of scheme and zone reads, and play-action fakes.",0,1,0,0
That kind of understanding of the game and your surroundings is what makes your quarterback elite.,0,1,0,0
He understands the run game and where the mismatches are by counting the linebackers. ,0,1,0,0
Tom Brady is one of the hardest to intercept.,0,1,0,0
"He gave kudos to Brady for his mental toughness, and ability to always think strategically. ",0,1,1,0
Belichick said that Brady is intelligent enough to look at the field and process a large amount of information very quickly.,0,1,0,0
It is very possible that Brady could be one of the smartest quarterbacks that the game of football has ever seen.,0,1,0,0
Mac Jones was a high-IQ field general with average physical tools.,1,1,0,0
"All Siemian has done is consistently play better than Lynch, essentially forcing the Broncos to keep him in the starting lineup.",0,0,0,0
"All that athleticism and a big arm, too?",1,0,0,0
All that has to do with how do you feel at that instant you have to make that decision.,0,0,0,0
All that stuff does get factored into the decision.,0,0,0,0
All that's left of the Luck decision is to wonder what might have been.,0,0,0,0
"All the boxes are checked and they can see he has the intelligence, the physical skills, the intangibles, the leadership.",1,1,1,0
"All the different throws, the corner routes, the speed outs, he's going to grow underneath center, but, for me, he was fun to watch.",0,0,0,0
All the guys that buy in to the fundamentals and are coached correctly all rise up.,0,0,0,0
"All the other components that make a quarterback bad, good or great - footwork, timing, accuracy - they can be polished.",0,0,0,0
"All the while, his ability to ""freelance"" was one of his strengths and certainly wasn't being coached out of him while at Texas Tech.",0,0,1,0
"All these ""great"" QBs I've compared him with have lesser athletic ability and physical tools than does Cam.",1,0,0,0
"All these issues with throwing downfield are a part of the learning curve for Jones, who is figuring out the speed at which pro passing windows shrink compared to college.",0,0,0,0
All they see is a short kid with questionable arm strength.,1,0,0,0
All three guys are 6-4 and above and all possess tremendous arm strength and the leadership abilities that NFL clubs are looking for.,1,0,0,0
All three have consistently tested negative for COVID-19 via both daily PCR (nasal swab) testing and additional POC (point of contact) testing administered as a precaution.,0,0,0,0
All three interceptions by Luck were underthrown passes to otherwise open receivers.,0,0,0,0
"Allen - big, athletic, raw and strong-armed out of Wyoming - did not win the job coming out of last summer but did not sit long behind Nathan Peterman.",1,0,0,0
Allen accepted soon after and made Wildcats head coach Mark Stoops look like a very smart man.,0,0,0,0
Allen acknowledges that he and Diggs are only part of the way there.,0,0,0,0
"Allen also has the requisite athleticism to run the zone-read, something that Daboll was known for implementing at Alabama.",1,0,0,0
Allen also tied NFL leaders for most fourth quarter comeback wins in 2019 with four.,0,0,0,0
"Allen began the game with eight straight passes before a run, most of them quick releases or guided by his physicality and ability to fire darts in all directions.",1,0,0,0
"Allen did his part Sunday, throwing four touchdown passes in a 35-32 victory over the Rams, the last coming with 15 seconds remaining to avoid a monumental Bills collapse.",0,0,0,0
"Allen fits the Strong Arm Player Archetype perfectly though, as he sports a 99 Throw Power.",1,0,0,0
"Allen had his one 15-yard scramble early in the third quarter, but otherwise rushed four times for 11 yards.",1,0,0,0
Allen has made significant developmental progress in his recent performances.,0,0,0,0
"Allen is a rocket-armed passer with a defensive end's body and a tight end's wheels, and that combination makes him one of the most physically imposing quarterbacks in the NFL.",1,0,0,0
"Allen is also already taking many other test too because not only is the team around Allen, talent wise that is, alarmingly lackluster, but he is also a rookie QB.",0,0,0,0
"Allen is getting too much attention for his prolific running (510 yards, nine TDs) than criticism for his erratic, inaccurate passing.",1,1,0,0
Allen is naturally excited about the addition of Stefon Diggs to their offensive arsenal.,0,0,0,0
"Allen isn't the only dynamic force on the Bills' offense, a fact Bledsoe's son and others watching Monday night's game with them greatly appreciated.",0,0,0,0
